<?xml version="1.0" encoding="utf-8"?>
<Tde xmlns:xsi="http://www.w3.org/2001/XMLSchema-instance" xsi:noNamespaceSchemaLocation="SubwayDeviceInfo.xsd">
	<StationGroups>
		<StationGroup>
			<Name>光达</Name>
			<Id>1</Id>
			<Device>
				<Name>T2954-1</Name>
				<StationNo>1</StationNo>
				<GeneralInfo>
					<StationGroupNo>1</StationGroupNo>
					<DeviceType>股道</DeviceType>
					<DeviceHandle>1</DeviceHandle>
				</GeneralInfo>
				<BitInfo>
					<Indication>
                    </Indication>
					<Control>
						<BitValueInfo>
							<Type>1</Type>
							<Value>1</Value>
						</BitValueInfo>
					</Control>
				</BitInfo>
				<LinkIcons>
					<Icon>T2954-1</Icon>
				</LinkIcons>
				<LinkDevice>
					<Dir>Up</Dir>
					<DeviceWithWindow>
						<Window>
							<StationGroupNo>1</StationGroupNo>
							<DeviceType>车次窗</DeviceType>
							<DeviceHandle>1</DeviceHandle>
						</Window>
						<PhysicTrackName>T2954</PhysicTrackName>
						<LogicTrack>
							<UpLinkDevice>
								<StationGroupNo>0</StationGroupNo>
								<DeviceType>无</DeviceType>
								<DeviceHandle>0</DeviceHandle>
							</UpLinkDevice>
							<DownLinkDevice>
								<StationGroupNo>0</StationGroupNo>
								<DeviceType>无</DeviceType>
								<DeviceHandle>0</DeviceHandle>
							</DownLinkDevice>
							<Length>1000</Length>
							<KmStart>0</KmStart>
							<KmEnd>1100</KmEnd>
							<LogicTrackInStation>
								<Platform>
									<StationGroupNo>0</StationGroupNo>
									<DeviceType>无</DeviceType>
									<DeviceHandle>0</DeviceHandle>
								</Platform>
							</LogicTrackInStation>
						</LogicTrack>
					</DeviceWithWindow>
				</LinkDevice>
			</Device>
		</StationGroup>
	</StationGroups>
</Tde>
