<?xml version="1.0" encoding="utf-8"?>
<Tde xmlns:xsi="http://www.w3.org/2001/XMLSchema-instance" xsi:noNamespaceSchemaLocation="SubwayDeviceInfo.xsd">
  <StationGroups>
    <StationGroup>
      <Name>光达站</Name>
      <Id>1</Id>
      <Device>
        <Guid>d3975ae8-ebb2-4f55-b8f4-57f9e3719cbc</Guid>
        <DeviceType>联锁区</DeviceType>
        <DeviceSubType>联锁区</DeviceSubType>
        <Name>光达站</Name>
        <StationNo>1</StationNo>
        <BitInfo>
          <Indication>
            <BitValueInfo>
              <Type>1</Type>
              <Value>1</Value>
            </BitValueInfo>
            <BitValueInfo>
              <Type>2</Type>
              <Value>2</Value>
            </BitValueInfo>
            <BitValueInfo>
              <Type>3</Type>
              <Value>3</Value>
            </BitValueInfo>
            <BitValueInfo>
              <Type>4</Type>
              <Value>4</Value>
            </BitValueInfo>
          </Indication>
          <Control>
          </Control>
        </BitInfo>
        <LinkIcons>
          <Icon>GenerAlarm1</Icon>
        </LinkIcons>
        <Head />
      </Device>
      <Device>
        <Guid>bb376da1-563d-45ca-989b-6a4fc05886b3</Guid>
        <DeviceType>道岔</DeviceType>
        <DeviceSubType>道岔</DeviceSubType>
        <Name>Switch_Right_Down_45</Name>
        <StationNo>1</StationNo>
        <BitInfo>
          <Indication>
          </Indication>
          <Control>
          </Control>
        </BitInfo>
        <LinkIcons>
          <Icon>Switch_Right_Down_451</Icon>
          <Icon>Switch_Right_Down_45</Icon>
        </LinkIcons>
        <LinkDevice>
          <Dir>Up</Dir>
          <DeviceWithWindow>
            <Window />
            <PhysicTrack>
            </PhysicTrack>
            <Switch>
              <NormalLinkDevice />
              <ReverseLinkDevice />
              <MainLinkDevice />
              <SwitchDir>右上</SwitchDir>
              <MainKM>0</MainKM>
              <NormalKM>0</NormalKM>
              <ReverseKM>0</ReverseKM>
              <CenterKM>0</CenterKM>
              <MainCbtcBlockId>0</MainCbtcBlockId>
              <NormalCbtcBlockId>0</NormalCbtcBlockId>
              <ReverseCbtcBlockId>0</ReverseCbtcBlockId>
            </Switch>
          </DeviceWithWindow>
        </LinkDevice>
      </Device>
      <Device>
        <Guid>7bea7b2a-f25c-43bf-bc2c-ac875168b37b</Guid>
        <DeviceType>股道</DeviceType>
        <DeviceSubType>股道</DeviceSubType>
        <Name>Track2</Name>
        <StationNo>1</StationNo>
        <BitInfo>
          <Indication>
            <BitValueInfo>
              <Type>7</Type>
              <Value>5</Value>
            </BitValueInfo>
          </Indication>
          <Control>
          </Control>
        </BitInfo>
        <LinkIcons>
          <Icon>Track1</Icon>
        </LinkIcons>
        <LinkDevice>
          <Dir>Up</Dir>
          <DeviceWithWindow>
            <Window />
            <PhysicTrack>
            </PhysicTrack>
            <LogicTrack>
              <UpLinkDevice />
              <DownLinkDevice />
              <Length>0</Length>
              <KmStart>0</KmStart>
              <LogicTrackInStation>
                <Platform />
              </LogicTrackInStation>
            </LogicTrack>
          </DeviceWithWindow>
        </LinkDevice>
      </Device>
      <Device>
        <Guid>073588f6-e6d2-486e-9712-f19e44fd58d8</Guid>
        <DeviceType>站台</DeviceType>
        <DeviceSubType>站台</DeviceSubType>
        <Name>111111</Name>
        <StationNo>1</StationNo>
        <BitInfo>
          <Indication>
          </Indication>
          <Control>
          </Control>
        </BitInfo>
        <LinkIcons>
          <Icon>111111</Icon>
        </LinkIcons>
        <Platform>
          <PlatformId>3</PlatformId>
          <DestNo>dsdfsdf</DestNo>
        </Platform>
      </Device>
      <Device>
        <Guid>93a7ff61-ee77-4e2a-b1be-92fa060b7056</Guid>
        <DeviceType>信号机</DeviceType>
        <DeviceSubType>无</DeviceSubType>
        <Name>Signal_Down1</Name>
        <StationNo>1</StationNo>
        <BitInfo>
          <Indication>
          </Indication>
          <Control>
          </Control>
        </BitInfo>
        <LinkIcons>
          <Icon>Signal_Down1</Icon>
        </LinkIcons>
        <LinkDevice>
          <Dir>Up</Dir>
          <Signal>
            <UpLinkDevice />
            <DownLinkDevice />
          </Signal>
        </LinkDevice>
      </Device>
    </StationGroup>
    <StationGroup>
      <Name>长沙火车南站</Name>
      <Id>0</Id>
    </StationGroup>
    <StationGroup>
      <Name>万家丽广场</Name>
      <Id>0</Id>
    </StationGroup>
    <StationGroup>
      <Name>长沙大道站</Name>
      <Id>0</Id>
    </StationGroup>
  </StationGroups>
</Tde>